<?xml version="1.0" encoding="UTF-8"?>
<!-- edited with XMLSpy v2006 U (http://www.altova.com) by Administrador (EMBRACE) -->
<!--Sample XML file generated by XMLSpy v2006 U (http://www.altova.com)-->
<Root xmlns:xsi="http://www.w3.org/2001/XMLSchema-instance" xsi:noNamespaceSchemaLocation="C:\WebPhp5\web\Nfs\xml\SqlNfs.xsd">
	<Sql>
		<Select>
			<SelCo1>s.nf ,  </SelCo1>
			<SelCo2> s.emissao ,  </SelCo2>
			<SelCo3>  s.valor </SelCo3>
			
			
			<SelFrom>
				<SelFromTab1>saidas s,</SelFromTab1>
				<SelFromTab2>itens_saidas it</SelFromTab2>
				<SelFromTab3/>
				<SelFromTab4/>
				<SelFromTab5/>
			</SelFrom>
			<SelWhere>
				<SelWhereCond1>where s.nf = it.nf</SelWhereCond1>
				<SelWhereCond2>and   s.serie = it.serie</SelWhereCond2>
				<SelWhereCond3>and   s.filial = it.filial</SelWhereCond3>
				<SelWhereCond4>and   s.filial = '001'</SelWhereCond4>
			</SelWhere>
		</Select>
	</Sql>
</Root>
